{
  "schema_id": "gait.gate.broker_credential_record",
  "schema_version": "1.0.0",
  "created_at": "2026-02-05T00:00:00Z",
  "producer_version": "0.0.0-dev",
  "trace_id": "trace_abc123",
  "tool_name": "tool.write",
  "identity": "alice",
  "broker": "env",
  "reference": "egress",
  "scope": ["export"],
  "credential_ref": "env:GAIT_BROKER_TOKEN_EGRESS:deadbeef"
}
